{"type":"config","name":"zsh-startup","metricName":"startup_ms","metricUnit":"ms","bestDirection":"lower"}
{"run":1,"commit":"e20a5b9","metric":107.238,"metrics":{"min_ms":90.355,"max_ms":199.544},"status":"keep","description":"baseline shows substantial launch jitter above the warm startup floor","timestamp":1784824779,"segment":0}
{"run":2,"commit":"e20a5b9","metric":96.603,"metrics":{"min_ms":80.186,"max_ms":224.556},"status":"keep","description":"baseline repeat confirms a roughly 80 ms warm floor and severe outliers","timestamp":1784825179,"segment":0}
{"run":3,"commit":"e20a5b9","metric":103.505,"metrics":{"min_ms":64.804,"max_ms":210.613},"status":"discard","description":"deferring generic prompt discovery lowers the floor but not the noisy median","timestamp":1784825213,"segment":0}
{"run":4,"commit":"6851a47","metric":92.323,"metrics":{"min_ms":64.694,"max_ms":193.091},"status":"keep","description":"removing duplicate synchronous zoxide initialization produces a consistent lower floor","timestamp":1784825270,"segment":0}
{"run":5,"commit":"6851a47","metric":85.425,"metrics":{"min_ms":63.990,"max_ms":164.651},"status":"discard","description":"raw wordcode is fast but an unmanaged version-specific artifact is not reproducible","timestamp":1784825320,"segment":0}
{"run":6,"commit":"6851a47","metric":224.456,"metrics":{"min_ms":111.487,"max_ms":1060.764},"status":"discard","description":"first managed-wordcode run was dominated by a transient system load spike","timestamp":1784825360,"segment":0}
{"run":7,"commit":"544133f","metric":88.815,"metrics":{"min_ms":68.749,"max_ms":104.719},"status":"keep","description":"self-invalidating wordcode retains the speedup without stale-cache behavior","timestamp":1784825402,"segment":0}
{"run":8,"commit":"544133f","metric":94.083,"metrics":{"min_ms":66.447,"max_ms":125.241},"status":"checks_failed","description":"direct queue records were correct but the autoload stub left scheduling unavailable","timestamp":1784825450,"segment":0}
{"run":9,"commit":"544133f","metric":113.994,"metrics":{"min_ms":96.732,"max_ms":169.730},"status":"checks_failed","description":"sourcing the autoload wrapper directly resolves its plugin path incorrectly","timestamp":1784825480,"segment":0}
{"run":10,"commit":"544133f","metric":122.458,"metrics":{"min_ms":89.637,"max_ms":186.485},"status":"discard","description":"direct plugin sourcing and queue construction are slower under load","timestamp":1784825510,"segment":0}
{"run":11,"commit":"544133f","metric":93.028,"metrics":{"min_ms":74.342,"max_ms":139.785},"status":"discard","description":"queue batching confirmation remains slower than the public zsh-defer calls","timestamp":1784825540,"segment":0}
{"run":12,"commit":"544133f","metric":130.545,"metrics":{"min_ms":84.489,"max_ms":269.780},"status":"discard","description":"wordcode for small Zim sources increases loading overhead under host contention","timestamp":1784825550,"segment":0}
{"run":13,"commit":"544133f","metric":117.844,"metrics":{"min_ms":84.179,"max_ms":223.896},"status":"discard","description":"Zim wordcode confirmation remains slower and provides no lower-floor gain","timestamp":1784825560,"segment":0}
{"run":14,"commit":"544133f","metric":107.842,"metrics":{"min_ms":81.325,"max_ms":552.616},"status":"discard","description":"removing Zim wordcode restores the prior warm floor despite severe host outliers","timestamp":1784825578,"segment":0}
{"run":15,"commit":"544133f","metric":104.632,"metrics":{"min_ms":81.783,"max_ms":270.174},"status":"discard","description":"idle syntax-highlighting load does not improve the median under sustained contention","timestamp":1784825600,"segment":0}
{"run":16,"commit":"544133f","metric":99.899,"metrics":{"min_ms":81.553,"max_ms":225.315},"status":"discard","description":"syntax-highlighting deferral confirmation remains above the kept result and warm floor","timestamp":1784825620,"segment":0}
{"run":17,"commit":"544133f","metric":98.935,"metrics":{"min_ms":75.418,"max_ms":819.886},"status":"discard","description":"native fnm setup is obscured by a single 820 ms host outlier","timestamp":1784825800,"segment":0}
{"run":18,"commit":"9a29663","metric":71.061,"metrics":{"min_ms":62.618,"max_ms":84.500},"status":"keep","description":"native per-shell fnm symlink removes the dominant subprocess without caching state","timestamp":1784825845,"segment":0}
{"run":19,"commit":"9a29663","metric":86.694,"metrics":{"min_ms":64.486,"max_ms":120.682},"status":"discard","description":"combining fixed fnm exports does not improve wordcode execution","timestamp":1784825900,"segment":0}
{"run":20,"commit":"9a29663","metric":99.883,"metrics":{"min_ms":72.751,"max_ms":126.167},"status":"discard","description":"restored fnm exports pass checks but host contention raises the median","timestamp":1784825940,"segment":0}
{"run":21,"commit":"9a29663","metric":91.472,"metrics":{"min_ms":73.873,"max_ms":171.920},"status":"discard","description":"deriving fnm architecture from CPUTYPE is portable but does not improve the metric","timestamp":1784825980,"segment":0}
{"run":22,"commit":"f7a7fde","metric":87.107,"metrics":{"min_ms":73.050,"max_ms":192.639},"status":"discard","description":"final kept-state check passes all contracts but remains above the best noisy median","timestamp":1784826122,"segment":0}
